{
  "$schema": "https://json-schema.org/draft/2020-12/schema",
  "$id": "https://srp.example.org/schema/r01-four-layer-representation-v0.9.json",
  "title": "SRP R-01 Four-Layer Complete Cue Representation Candidate",
  "type": "object",
  "additionalProperties": false,
  "required": [
    "schema_version",
    "status",
    "evidence_status",
    "module_id",
    "cue_mode",
    "timing",
    "layers",
    "mapping",
    "fallback_contract",
    "confound_budget",
    "provenance"
  ],
  "properties": {
    "schema_version": {
      "const": "0.9-candidate"
    },
    "status": {
      "const": "CANDIDATE"
    },
    "evidence_status": {
      "const": "PLANNED_NOT_OBSERVED"
    },
    "module_id": {
      "enum": [
        "storm",
        "scorching",
        "blizzard",
        "fading"
      ]
    },
    "cue_mode": {
      "enum": [
        "scene_native",
        "abstract_pacer"
      ]
    },
    "timing": {
      "type": "object",
      "additionalProperties": false,
      "required": [
        "telemetry_hz",
        "target_render_fps",
        "demo_seconds",
        "closed_loop_seconds",
        "lock_transition_seconds"
      ],
      "properties": {
        "telemetry_hz": {
          "const": 20
        },
        "target_render_fps": {
          "type": "integer",
          "minimum": 30,
          "maximum": 240
        },
        "demo_seconds": {
          "type": "number",
          "minimum": 24,
          "maximum": 30
        },
        "closed_loop_seconds": {
          "type": "number",
          "minimum": 140,
          "maximum": 160
        },
        "lock_transition_seconds": {
          "type": "number",
          "minimum": 20,
          "maximum": 30
        }
      }
    },
    "layers": {
      "type": "object",
      "additionalProperties": false,
      "required": [
        "target",
        "actual",
        "cumulative",
        "fallback"
      ],
      "properties": {
        "target": {
          "type": "object",
          "additionalProperties": false,
          "required": [
            "source",
            "fields",
            "semantic_role",
            "smoothing_ms"
          ],
          "properties": {
            "source": {
              "const": "python.target_protocol"
            },
            "fields": {
              "const": [
                "target_phase",
                "target_progress"
              ]
            },
            "semantic_role": {
              "const": "prescriptive_current_and_next_phase"
            },
            "smoothing_ms": {
              "type": "integer",
              "minimum": 0,
              "maximum": 250
            }
          }
        },
        "actual": {
          "type": "object",
          "additionalProperties": false,
          "required": [
            "source",
            "fields",
            "semantic_role",
            "smoothing_ms"
          ],
          "properties": {
            "source": {
              "const": "python.interaction_state_estimate"
            },
            "fields": {
              "const": [
                "actual_phase",
                "actual_progress",
                "actual_confidence"
              ]
            },
            "semantic_role": {
              "const": "descriptive_current_estimate"
            },
            "smoothing_ms": {
              "type": "integer",
              "minimum": 0,
              "maximum": 500
            }
          }
        },
        "cumulative": {
          "type": "object",
          "additionalProperties": false,
          "required": [
            "source",
            "fields",
            "semantic_role",
            "visual_time_constant_seconds"
          ],
          "properties": {
            "source": {
              "const": "python.recovery_aggregate"
            },
            "fields": {
              "const": [
                "recovery_value",
                "recovery_locked"
              ]
            },
            "semantic_role": {
              "const": "module_to_date_aggregate"
            },
            "visual_time_constant_seconds": {
              "type": "number",
              "minimum": 2,
              "maximum": 10
            }
          }
        },
        "fallback": {
          "type": "object",
          "additionalProperties": false,
          "required": [
            "source",
            "fields",
            "semantic_role",
            "participant_blame_forbidden"
          ],
          "properties": {
            "source": {
              "const": "python.signal_quality"
            },
            "fields": {
              "const": [
                "signal_quality",
                "fallback_state",
                "fallback_reason"
              ]
            },
            "semantic_role": {
              "const": "epistemic_reliability_and_display_policy"
            },
            "participant_blame_forbidden": {
              "const": true
            }
          }
        }
      }
    },
    "mapping": {
      "type": "object",
      "additionalProperties": false,
      "required": [
        "core_mechanism_id",
        "target_presentation",
        "actual_presentation",
        "cumulative_presentation",
        "fallback_presentation",
        "color_is_not_sole_channel"
      ],
      "properties": {
        "core_mechanism_id": {
          "enum": [
            "storm_field",
            "thermal_flow",
            "snow_drift",
            "chromatic_return"
          ]
        },
        "target_presentation": {
          "enum": [
            "scene_far_field",
            "abstract_outer_ring"
          ]
        },
        "actual_presentation": {
          "enum": [
            "scene_near_field",
            "abstract_inner_ring"
          ]
        },
        "cumulative_presentation": {
          "const": "shared_scene_slow_variable"
        },
        "fallback_presentation": {
          "enum": [
            "scene_actual_channel_attenuation",
            "inner_ring_attenuation"
          ]
        },
        "color_is_not_sole_channel": {
          "const": true
        }
      }
    },
    "fallback_contract": {
      "type": "object",
      "additionalProperties": false,
      "required": [
        "GOOD",
        "DEGRADED",
        "UNUSABLE",
        "DISCONNECTED"
      ],
      "properties": {
        "GOOD": {
          "const": {
            "target": "continue",
            "actual": "real",
            "cumulative": "update"
          }
        },
        "DEGRADED": {
          "type": "object",
          "additionalProperties": false,
          "required": [
            "target",
            "actual",
            "cumulative"
          ],
          "properties": {
            "target": {
              "const": "continue"
            },
            "actual": {
              "const": "attenuate"
            },
            "cumulative": {
              "enum": [
                "pause",
                "cautious_update"
              ]
            }
          }
        },
        "UNUSABLE": {
          "const": {
            "target": "open_loop",
            "actual": "stop",
            "cumulative": "pause"
          }
        },
        "DISCONNECTED": {
          "type": "object",
          "additionalProperties": false,
          "required": [
            "target",
            "actual",
            "cumulative"
          ],
          "properties": {
            "target": {
              "enum": [
                "safe_open_loop",
                "abort"
              ]
            },
            "actual": {
              "const": "stop"
            },
            "cumulative": {
              "const": "pause"
            }
          }
        }
      }
    },
    "confound_budget": {
      "type": "object",
      "additionalProperties": false,
      "required": [
        "evidence_label",
        "freeze_status",
        "motion_energy_relative_difference",
        "mean_luminance_absolute_difference",
        "visual_complexity_relative_difference",
        "eccentricity_difference_degrees",
        "occlusion_absolute_difference",
        "event_salience_relative_difference"
      ],
      "properties": {
        "evidence_label": {
          "const": "ENGINEERING_CANDIDATE"
        },
        "freeze_status": {
          "const": "PENDING_LIVE_MEASUREMENT"
        },
        "motion_energy_relative_difference": {
          "type": "number",
          "minimum": 0,
          "maximum": 0.1
        },
        "mean_luminance_absolute_difference": {
          "type": "number",
          "minimum": 0,
          "maximum": 0.05
        },
        "visual_complexity_relative_difference": {
          "type": "number",
          "minimum": 0,
          "maximum": 0.1
        },
        "eccentricity_difference_degrees": {
          "type": "number",
          "minimum": 0,
          "maximum": 2.0
        },
        "occlusion_absolute_difference": {
          "type": "number",
          "minimum": 0,
          "maximum": 0.03
        },
        "event_salience_relative_difference": {
          "type": "number",
          "minimum": 0,
          "maximum": 0.15
        }
      }
    },
    "provenance": {
      "type": "object",
      "additionalProperties": false,
      "required": [
        "protocol_version",
        "config_hash",
        "unity_build_hash",
        "review_status"
      ],
      "properties": {
        "protocol_version": {
          "const": "1.1"
        },
        "config_hash": {
          "type": "string",
          "pattern": "^[A-Fa-f0-9]{64}$"
        },
        "unity_build_hash": {
          "type": "string",
          "minLength": 7
        },
        "review_status": {
          "const": "NOT_DUAL_REVIEWED"
        }
      }
    }
  },
  "allOf": [
    {
      "if": {
        "properties": {
          "cue_mode": {
            "const": "scene_native"
          }
        }
      },
      "then": {
        "properties": {
          "mapping": {
            "properties": {
              "target_presentation": {
                "const": "scene_far_field"
              },
              "actual_presentation": {
                "const": "scene_near_field"
              },
              "fallback_presentation": {
                "const": "scene_actual_channel_attenuation"
              }
            }
          }
        }
      }
    },
    {
      "if": {
        "properties": {
          "cue_mode": {
            "const": "abstract_pacer"
          }
        }
      },
      "then": {
        "properties": {
          "mapping": {
            "properties": {
              "target_presentation": {
                "const": "abstract_outer_ring"
              },
              "actual_presentation": {
                "const": "abstract_inner_ring"
              },
              "fallback_presentation": {
                "const": "inner_ring_attenuation"
              }
            }
          }
        }
      }
    },
    {
      "if": {
        "properties": {
          "module_id": {
            "const": "storm"
          }
        }
      },
      "then": {
        "properties": {
          "mapping": {
            "properties": {
              "core_mechanism_id": {
                "const": "storm_field"
              }
            }
          }
        }
      }
    },
    {
      "if": {
        "properties": {
          "module_id": {
            "const": "scorching"
          }
        }
      },
      "then": {
        "properties": {
          "mapping": {
            "properties": {
              "core_mechanism_id": {
                "const": "thermal_flow"
              }
            }
          }
        }
      }
    },
    {
      "if": {
        "properties": {
          "module_id": {
            "const": "blizzard"
          }
        }
      },
      "then": {
        "properties": {
          "mapping": {
            "properties": {
              "core_mechanism_id": {
                "const": "snow_drift"
              }
            }
          }
        }
      }
    },
    {
      "if": {
        "properties": {
          "module_id": {
            "const": "fading"
          }
        }
      },
      "then": {
        "properties": {
          "mapping": {
            "properties": {
              "core_mechanism_id": {
                "const": "chromatic_return"
              }
            }
          }
        }
      }
    }
  ]
}
